mysql> use da4;
Database changed
mysql> CREATE TABLE Projects (
    ->    id INT,
    ->    name VARCHAR(100),
    ->    assignedto VARCHAR(100),
    ->    start DATE,
    ->    end DATE
    -> );
Query OK, 0 rows affected (0.06 sec)

mysql> INSERT INTO Projects VALUES
    -> (1, 'Website Revamp', 'Alice', '2024-01-15', '2024-03-01'),
    -> (2, 'Mobile App', 'Bob', '2024-02-01', NULL),
    -> (3, 'Data Migration', NULL, NULL, NULL),
    -> (4, 'SEO Optimization', 'Eve', '2024-03-10', '2024-04-20'),
    -> (5, 'Cloud Migration', NULL, '2024-03-15', NULL);
Query OK, 5 rows affected (0.01 sec)
Records: 5  Duplicates: 0  Warnings: 0

mysql> select * from projects;
+------+------------------+------------+------------+------------+
| id   | name             | assignedto | start      | end        |
+------+------------------+------------+------------+------------+
|    1 | Website Revamp   | Alice      | 2024-01-15 | 2024-03-01 |
|    2 | Mobile App       | Bob        | 2024-02-01 | NULL       |
|    3 | Data Migration   | NULL       | NULL       | NULL       |
|    4 | SEO Optimization | Eve        | 2024-03-10 | 2024-04-20 |
|    5 | Cloud Migration  | NULL       | 2024-03-15 | NULL       |
+------+------------------+------------+------------+------------+
5 rows in set (0.00 sec)

mysql> select * from projects where assignedto=NULL;
Empty set (0.00 sec)

mysql> select * from projects where assignedto IS NULL;
+------+-----------------+------------+------------+------+
| id   | name            | assignedto | start      | end  |
+------+-----------------+------------+------------+------+
|    3 | Data Migration  | NULL       | NULL       | NULL |
|    5 | Cloud Migration | NULL       | 2024-03-15 | NULL |
+------+-----------------+------------+------------+------+
2 rows in set (0.00 sec)

mysql> select * from projects where start IS NULL;
+------+----------------+------------+-------+------+
| id   | name           | assignedto | start | end  |
+------+----------------+------------+-------+------+
|    3 | Data Migration | NULL       | NULL  | NULL |
+------+----------------+------------+-------+------+
1 row in set (0.00 sec)

mysql> select * from projects where end IS NOT NULL;
+------+------------------+------------+------------+------------+
| id   | name             | assignedto | start      | end        |
+------+------------------+------------+------------+------------+
|    1 | Website Revamp   | Alice      | 2024-01-15 | 2024-03-01 |
|    4 | SEO Optimization | Eve        | 2024-03-10 | 2024-04-20 |
+------+------------------+------------+------------+------------+
2 rows in set (0.00 sec)

mysql> select * from projects where assignedto IS NOT NULL;
+------+------------------+------------+------------+------------+
| id   | name             | assignedto | start      | end        |
+------+------------------+------------+------------+------------+
|    1 | Website Revamp   | Alice      | 2024-01-15 | 2024-03-01 |
|    2 | Mobile App       | Bob        | 2024-02-01 | NULL       |
|    4 | SEO Optimization | Eve        | 2024-03-10 | 2024-04-20 |
+------+------------------+------------+------------+------------+
3 rows in set (0.00 sec)


mysql> update projects set assignedto = 'Frank' where assignedto is null;
Query OK, 2 rows affected (0.01 sec)
Rows matched: 2  Changed: 2  Warnings: 0

mysql> select * from projects;
+------+------------------+------------+------------+------------+
| id   | name             | assignedto | start      | end        |
+------+------------------+------------+------------+------------+
|    1 | Website Revamp   | Alice      | 2024-01-15 | 2024-03-01 |
|    2 | Mobile App       | Bob        | 2024-02-01 | NULL       |
|    3 | Data Migration   | Frank      | NULL       | NULL       |
|    4 | SEO Optimization | Eve        | 2024-03-10 | 2024-04-20 |
|    5 | Cloud Migration  | Frank      | 2024-03-15 | NULL       |
+------+------------------+------------+------------+------------+
5 rows in set (0.00 sec)

mysql> update projects set start = now() where start is null;
Query OK, 1 row affected, 1 warning (0.01 sec)
Rows matched: 1  Changed: 1  Warnings: 1

mysql> select * from projects;
+------+------------------+------------+------------+------------+
| id   | name             | assignedto | start      | end        |
+------+------------------+------------+------------+------------+
|    1 | Website Revamp   | Alice      | 2024-01-15 | 2024-03-01 |
|    2 | Mobile App       | Bob        | 2024-02-01 | NULL       |
|    3 | Data Migration   | Frank      | 2026-07-23 | NULL       |
|    4 | SEO Optimization | Eve        | 2024-03-10 | 2024-04-20 |
|    5 | Cloud Migration  | Frank      | 2024-03-15 | NULL       |
+------+------------------+------------+------------+------------+
5 rows in set (0.00 sec)

mysql> update projects set assignedto = 'completed' where end is not null;
Query OK, 2 rows affected (0.01 sec)
Rows matched: 2  Changed: 2  Warnings: 0

mysql> select * from projects;
+------+------------------+------------+------------+------------+
| id   | name             | assignedto | start      | end        |
+------+------------------+------------+------------+------------+
|    1 | Website Revamp   | completed  | 2024-01-15 | 2024-03-01 |
|    2 | Mobile App       | Bob        | 2024-02-01 | NULL       |
|    3 | Data Migration   | Frank      | 2026-07-23 | NULL       |
|    4 | SEO Optimization | completed  | 2024-03-10 | 2024-04-20 |
|    5 | Cloud Migration  | Frank      | 2024-03-15 | NULL       |
+------+------------------+------------+------------+------------+
5 rows in set (0.00 sec)

mysql> delete from projects where assignedto is null;
Query OK, 0 rows affected (0.00 sec)

mysql> delete from projects where start is null;
Query OK, 0 rows affected (0.00 sec)

mysql> delete from projects where end is not null;
Query OK, 2 rows affected (0.01 sec)

mysql> select * from projects;
+------+-----------------+------------+------------+------+
| id   | name            | assignedto | start      | end  |
+------+-----------------+------------+------------+------+
|    2 | Mobile App      | Bob        | 2024-02-01 | NULL |
|    3 | Data Migration  | Frank      | 2026-07-23 | NULL |
|    5 | Cloud Migration | Frank      | 2024-03-15 | NULL |
+------+-----------------+------------+------------+------+
3 rows in set (0.00 sec)

mysql> show tables;
+------------------+
| Tables_in_da4    |
+------------------+
| backup_employees |
| company_staff    |
| employee         |
| employees        |
| products         |
| projects         |
| students         |
| studentscores    |
+------------------+
8 rows in set (0.01 sec)

mysql> CREATE TABLE Orders (
    ->  id INT,
    ->  customer_name VARCHAR(100),
    ->  order_date DATE,
    ->  total_amount DECIMAL(10,2)
    ->  );
Query OK, 0 rows affected (0.03 sec)

mysql> INSERT INTO Orders VALUES
    ->  (1, 'Alice', '2024-03-01', 1500.00),
    ->  (2, 'Bob', '2024-03-05', 450.00),
    ->  (3, 'Charlie', '2024-03-10', 2500.00),
    ->  (4, 'Diana', '2024-03-15', 800.00),
    ->  (5, 'Eve', '2024-03-20', 1200.00),
    ->  (6, 'Frank', '2024-03-25', 3000.00),
    ->  (7, 'Grace', '2024-04-02', 1800.00),
    ->  (8, 'Henry', '2024-04-08', 950.00),
    ->  (9, 'Ivy', '2024-04-12', 2750.00),
    ->  (10, 'Jack', '2024-04-18', 650.00),
    ->  (11, 'Kevin', '2024-04-22', 4200.00),
    ->  (12, 'Lily', '2024-05-01', 1350.00),
    ->  (13, 'Michael', '2024-05-08', 5000.00),
    ->  (14, 'Nancy', '2024-05-15', 2250.00),
    ->  (15, 'Oliver', '2024-05-25', 900.00);
Query OK, 15 rows affected (0.01 sec)
Records: 15  Duplicates: 0  Warnings: 0

mysql> select * from orders;
+------+---------------+------------+--------------+
| id   | customer_name | order_date | total_amount |
+------+---------------+------------+--------------+
|    1 | Alice         | 2024-03-01 |      1500.00 |
|    2 | Bob           | 2024-03-05 |       450.00 |
|    3 | Charlie       | 2024-03-10 |      2500.00 |
|    4 | Diana         | 2024-03-15 |       800.00 |
|    5 | Eve           | 2024-03-20 |      1200.00 |
|    6 | Frank         | 2024-03-25 |      3000.00 |
|    7 | Grace         | 2024-04-02 |      1800.00 |
|    8 | Henry         | 2024-04-08 |       950.00 |
|    9 | Ivy           | 2024-04-12 |      2750.00 |
|   10 | Jack          | 2024-04-18 |       650.00 |
|   11 | Kevin         | 2024-04-22 |      4200.00 |
|   12 | Lily          | 2024-05-01 |      1350.00 |
|   13 | Michael       | 2024-05-08 |      5000.00 |
|   14 | Nancy         | 2024-05-15 |      2250.00 |
|   15 | Oliver        | 2024-05-25 |       900.00 |
+------+---------------+------------+--------------+
15 rows in set (0.00 sec)

mysql> select * from orders where order_date between '2024-03-03' and '2024-03-10';
+------+---------------+------------+--------------+
| id   | customer_name | order_date | total_amount |
+------+---------------+------------+--------------+
|    2 | Bob           | 2024-03-05 |       450.00 |
|    3 | Charlie       | 2024-03-10 |      2500.00 |
+------+---------------+------------+--------------+
2 rows in set (0.00 sec)

mysql> select * from orders where order_date between '2024-04-01' and '2024-04-30';
+------+---------------+------------+--------------+
| id   | customer_name | order_date | total_amount |
+------+---------------+------------+--------------+
|    7 | Grace         | 2024-04-02 |      1800.00 |
|    8 | Henry         | 2024-04-08 |       950.00 |
|    9 | Ivy           | 2024-04-12 |      2750.00 |
|   10 | Jack          | 2024-04-18 |       650.00 |
|   11 | Kevin         | 2024-04-22 |      4200.00 |
+------+---------------+------------+--------------+
5 rows in set (0.00 sec)

mysql> select * from orders where total_amount between 500 and 1500;
+------+---------------+------------+--------------+
| id   | customer_name | order_date | total_amount |
+------+---------------+------------+--------------+
|    1 | Alice         | 2024-03-01 |      1500.00 |
|    4 | Diana         | 2024-03-15 |       800.00 |
|    5 | Eve           | 2024-03-20 |      1200.00 |
|    8 | Henry         | 2024-04-08 |       950.00 |
|   10 | Jack          | 2024-04-18 |       650.00 |
|   12 | Lily          | 2024-05-01 |      1350.00 |
|   15 | Oliver        | 2024-05-25 |       900.00 |
+------+---------------+------------+--------------+
7 rows in set (0.00 sec)

mysql> ^C
mysql> update orders set total_amount = total_amount+1000 where order_date between '2024-03-04' and '2024-03-10';
Query OK, 2 rows affected (0.01 sec)
Rows matched: 2  Changed: 2  Warnings: 0

mysql> select * from orders;
+------+---------------+------------+--------------+
| id   | customer_name | order_date | total_amount |
+------+---------------+------------+--------------+
|    1 | Alice         | 2024-03-01 |      1500.00 |
|    2 | Bob           | 2024-03-05 |      1450.00 |
|    3 | Charlie       | 2024-03-10 |      3500.00 |
|    4 | Diana         | 2024-03-15 |       800.00 |
|    5 | Eve           | 2024-03-20 |      1200.00 |
|    6 | Frank         | 2024-03-25 |      3000.00 |
|    7 | Grace         | 2024-04-02 |      1800.00 |
|    8 | Henry         | 2024-04-08 |       950.00 |
|    9 | Ivy           | 2024-04-12 |      2750.00 |
|   10 | Jack          | 2024-04-18 |       650.00 |
|   11 | Kevin         | 2024-04-22 |      4200.00 |
|   12 | Lily          | 2024-05-01 |      1350.00 |
|   13 | Michael       | 2024-05-08 |      5000.00 |
|   14 | Nancy         | 2024-05-15 |      2250.00 |
|   15 | Oliver        | 2024-05-25 |       900.00 |
+------+---------------+------------+--------------+
15 rows in set (0.00 sec)

mysql> update orders set total_amount = total_amount-200 where total_amount between 1000 and 2000;
Query OK, 5 rows affected (0.01 sec)
Rows matched: 5  Changed: 5  Warnings: 0

mysql> select * from orders;
+------+---------------+------------+--------------+
| id   | customer_name | order_date | total_amount |
+------+---------------+------------+--------------+
|    1 | Alice         | 2024-03-01 |      1300.00 |
|    2 | Bob           | 2024-03-05 |      1250.00 |
|    3 | Charlie       | 2024-03-10 |      3500.00 |
|    4 | Diana         | 2024-03-15 |       800.00 |
|    5 | Eve           | 2024-03-20 |      1000.00 |
|    6 | Frank         | 2024-03-25 |      3000.00 |
|    7 | Grace         | 2024-04-02 |      1600.00 |
|    8 | Henry         | 2024-04-08 |       950.00 |
|    9 | Ivy           | 2024-04-12 |      2750.00 |
|   10 | Jack          | 2024-04-18 |       650.00 |
|   11 | Kevin         | 2024-04-22 |      4200.00 |
|   12 | Lily          | 2024-05-01 |      1150.00 |
|   13 | Michael       | 2024-05-08 |      5000.00 |
|   14 | Nancy         | 2024-05-15 |      2250.00 |
|   15 | Oliver        | 2024-05-25 |       900.00 |
+------+---------------+------------+--------------+
15 rows in set (0.00 sec)

mysql> update orders set total_amount = total_amount+(total_amount*0.1) where order_date between 2500 and 5000;
ERROR 1292 (22007): Incorrect date value: '2500' for column 'order_date' at row 1
mysql> update orders set total_amount = total_amount+(total_amount*0.1) where total_amount between 2500 and 5000;
Query OK, 5 rows affected (0.00 sec)
Rows matched: 5  Changed: 5  Warnings: 0

mysql> select * from orders;
+------+---------------+------------+--------------+
| id   | customer_name | order_date | total_amount |
+------+---------------+------------+--------------+
|    1 | Alice         | 2024-03-01 |      1300.00 |
|    2 | Bob           | 2024-03-05 |      1250.00 |
|    3 | Charlie       | 2024-03-10 |      3850.00 |
|    4 | Diana         | 2024-03-15 |       800.00 |
|    5 | Eve           | 2024-03-20 |      1000.00 |
|    6 | Frank         | 2024-03-25 |      3300.00 |
|    7 | Grace         | 2024-04-02 |      1600.00 |
|    8 | Henry         | 2024-04-08 |       950.00 |
|    9 | Ivy           | 2024-04-12 |      3025.00 |
|   10 | Jack          | 2024-04-18 |       650.00 |
|   11 | Kevin         | 2024-04-22 |      4620.00 |
|   12 | Lily          | 2024-05-01 |      1150.00 |
|   13 | Michael       | 2024-05-08 |      5500.00 |
|   14 | Nancy         | 2024-05-15 |      2250.00 |
|   15 | Oliver        | 2024-05-25 |       900.00 |
+------+---------------+------------+--------------+
15 rows in set (0.00 sec)

mysql> delete from orders where order_date between  '2024-03-10' and ' 2024-03-20';
Query OK, 3 rows affected, 15 warnings (0.01 sec)

mysql> select * from orders;
+------+---------------+------------+--------------+
| id   | customer_name | order_date | total_amount |
+------+---------------+------------+--------------+
|    1 | Alice         | 2024-03-01 |      1300.00 |
|    2 | Bob           | 2024-03-05 |      1250.00 |
|    6 | Frank         | 2024-03-25 |      3300.00 |
|    7 | Grace         | 2024-04-02 |      1600.00 |
|    8 | Henry         | 2024-04-08 |       950.00 |
|    9 | Ivy           | 2024-04-12 |      3025.00 |
|   10 | Jack          | 2024-04-18 |       650.00 |
|   11 | Kevin         | 2024-04-22 |      4620.00 |
|   12 | Lily          | 2024-05-01 |      1150.00 |
|   13 | Michael       | 2024-05-08 |      5500.00 |
|   14 | Nancy         | 2024-05-15 |      2250.00 |
|   15 | Oliver        | 2024-05-25 |       900.00 |
+------+---------------+------------+--------------+
12 rows in set (0.00 sec)

mysql> delete from oeders where total_amount between 2500 and 5000;
ERROR 1146 (42S02): Table 'da4.oeders' doesn't exist
mysql> delete from orders where total_amount between 2500 and 5000;
Query OK, 3 rows affected (0.00 sec)

mysql> select * from orders;
+------+---------------+------------+--------------+
| id   | customer_name | order_date | total_amount |
+------+---------------+------------+--------------+
|    1 | Alice         | 2024-03-01 |      1300.00 |
|    2 | Bob           | 2024-03-05 |      1250.00 |
|    7 | Grace         | 2024-04-02 |      1600.00 |
|    8 | Henry         | 2024-04-08 |       950.00 |
|   10 | Jack          | 2024-04-18 |       650.00 |
|   12 | Lily          | 2024-05-01 |      1150.00 |
|   13 | Michael       | 2024-05-08 |      5500.00 |
|   14 | Nancy         | 2024-05-15 |      2250.00 |
|   15 | Oliver        | 2024-05-25 |       900.00 |
+------+---------------+------------+--------------+
9 rows in set (0.00 sec)

mysql> CREATE TABLE Emp (
    ->  id INT,
    ->  name VARCHAR(100),
    ->  dept VARCHAR(20),
    ->  salary INT
    ->  );
Query OK, 0 rows affected (0.04 sec)

mysql> INSERT INTO Emp VALUES
    ->  (1, 'Alice', 'HR', 35000),
    ->  (2, 'Bob', 'IT', 50000),
    ->  (3, 'Charlie', 'Finance', 45000),
    ->  (4, 'Diana', 'Marketing', 40000),
    ->  (5, 'Eve', 'IT', 55000),
    ->  (6, 'Frank', 'Finance', 48000),
    ->  (7, 'Grace', 'Sales', 37000),
    ->  (8, 'Henry', 'Admin', 42000),
    ->  (9, 'Ivy', 'HR', 39000),
    ->  (10, 'Jack', 'Sales', 46000),
    ->  (11, 'Kevin', 'IT', 60000),
    ->  (12, 'Lily', 'Marketing', 41000),
    ->  (13, 'Michael', 'Admin', 38000),
    ->  (14, 'Nancy', 'Finance', 52000),
    ->  (15, 'Oliver', 'HR', 43000);
Query OK, 15 rows affected (0.01 sec)
Records: 15  Duplicates: 0  Warnings: 0

mysql> select * from emp;
+------+---------+-----------+--------+
| id   | name    | dept      | salary |
+------+---------+-----------+--------+
|    1 | Alice   | HR        |  35000 |
|    2 | Bob     | IT        |  50000 |
|    3 | Charlie | Finance   |  45000 |
|    4 | Diana   | Marketing |  40000 |
|    5 | Eve     | IT        |  55000 |
|    6 | Frank   | Finance   |  48000 |
|    7 | Grace   | Sales     |  37000 |
|    8 | Henry   | Admin     |  42000 |
|    9 | Ivy     | HR        |  39000 |
|   10 | Jack    | Sales     |  46000 |
|   11 | Kevin   | IT        |  60000 |
|   12 | Lily    | Marketing |  41000 |
|   13 | Michael | Admin     |  38000 |
|   14 | Nancy   | Finance   |  52000 |
|   15 | Oliver  | HR        |  43000 |
+------+---------+-----------+--------+
15 rows in set (0.00 sec)

mysql> select * from emp where dept in('IT','Finance');
+------+---------+---------+--------+
| id   | name    | dept    | salary |
+------+---------+---------+--------+
|    2 | Bob     | IT      |  50000 |
|    3 | Charlie | Finance |  45000 |
|    5 | Eve     | IT      |  55000 |
|    6 | Frank   | Finance |  48000 |
|   11 | Kevin   | IT      |  60000 |
|   14 | Nancy   | Finance |  52000 |
+------+---------+---------+--------+
6 rows in set (0.01 sec)

mysql> update emp set salary=salary+2000 where dept in('HR','Marketing');
Query OK, 5 rows affected (0.01 sec)
Rows matched: 5  Changed: 5  Warnings: 0

mysql> select * from emp;
+------+---------+-----------+--------+
| id   | name    | dept      | salary |
+------+---------+-----------+--------+
|    1 | Alice   | HR        |  37000 |
|    2 | Bob     | IT        |  50000 |
|    3 | Charlie | Finance   |  45000 |
|    4 | Diana   | Marketing |  42000 |
|    5 | Eve     | IT        |  55000 |
|    6 | Frank   | Finance   |  48000 |
|    7 | Grace   | Sales     |  37000 |
|    8 | Henry   | Admin     |  42000 |
|    9 | Ivy     | HR        |  41000 |
|   10 | Jack    | Sales     |  46000 |
|   11 | Kevin   | IT        |  60000 |
|   12 | Lily    | Marketing |  43000 |
|   13 | Michael | Admin     |  38000 |
|   14 | Nancy   | Finance   |  52000 |
|   15 | Oliver  | HR        |  45000 |
+------+---------+-----------+--------+
15 rows in set (0.00 sec)

mysql> delete from emp where dept in('Finance','marketing');
Query OK, 5 rows affected (0.01 sec)

mysql> select * from emp;
+------+---------+-------+--------+
| id   | name    | dept  | salary |
+------+---------+-------+--------+
|    1 | Alice   | HR    |  37000 |
|    2 | Bob     | IT    |  50000 |
|    5 | Eve     | IT    |  55000 |
|    7 | Grace   | Sales |  37000 |
|    8 | Henry   | Admin |  42000 |
|    9 | Ivy     | HR    |  41000 |
|   10 | Jack    | Sales |  46000 |
|   11 | Kevin   | IT    |  60000 |
|   13 | Michael | Admin |  38000 |
|   15 | Oliver  | HR    |  45000 |
+------+---------+-------+--------+
10 rows in set (0.00 sec)

mysql> delete from emp where dept in('sales','it');
Query OK, 5 rows affected (0.01 sec)

mysql> select * from emp;
+------+---------+-------+--------+
| id   | name    | dept  | salary |
+------+---------+-------+--------+
|    1 | Alice   | HR    |  37000 |
|    8 | Henry   | Admin |  42000 |
|    9 | Ivy     | HR    |  41000 |
|   13 | Michael | Admin |  38000 |
|   15 | Oliver  | HR    |  45000 |
+------+---------+-------+--------+
5 rows in set (0.00 sec)

mysql> delete from emp where dept in('admin','hr');
Query OK, 5 rows affected (0.01 sec)

mysql> select * from emp;
Empty set (0.00 sec)

mysql> 
mysql> INSERT INTO Emp VALUES
    ->  (1, 'Rahul', 'IT', 50000),
    ->  (2, 'Ramesh', 'HR', 35000),
    ->  (3, 'Karan', 'Finance', 45000),
    ->  (4, 'Mahesh', 'Marketing', 40000),
    ->  (5, 'Suresh', 'IT', 55000),
    ->  (6, 'Arjun', 'Sales', 38000),
    ->  (7, 'Manish', 'Admin', 42000),
    ->  (8, 'Ganesh', 'Finance', 47000),
    ->  (9, 'Naresh', 'HR', 39000),
    ->  (10, 'Rohan', 'IT', 52000),
    ->  (11, 'Mohan', 'Sales', 41000),
    ->  (12, 'Kishan', 'Marketing', 43000),
    ->  (13, 'Dinesh', 'Admin', 46000),
    ->  (14, 'Rajesh', 'Finance', 51000),
    ->  (15, 'Kiran', 'IT', 48000);
Query OK, 15 rows affected (0.01 sec)
Records: 15  Duplicates: 0  Warnings: 0

mysql> select * from emp;
+------+--------+-----------+--------+
| id   | name   | dept      | salary |
+------+--------+-----------+--------+
|    1 | Rahul  | IT        |  50000 |
|    2 | Ramesh | HR        |  35000 |
|    3 | Karan  | Finance   |  45000 |
|    4 | Mahesh | Marketing |  40000 |
|    5 | Suresh | IT        |  55000 |
|    6 | Arjun  | Sales     |  38000 |
|    7 | Manish | Admin     |  42000 |
|    8 | Ganesh | Finance   |  47000 |
|    9 | Naresh | HR        |  39000 |
|   10 | Rohan  | IT        |  52000 |
|   11 | Mohan  | Sales     |  41000 |
|   12 | Kishan | Marketing |  43000 |
|   13 | Dinesh | Admin     |  46000 |
|   14 | Rajesh | Finance   |  51000 |
|   15 | Kiran  | IT        |  48000 |
+------+--------+-----------+--------+
15 rows in set (0.00 sec)

mysql> select * from emp where name like 'r%';
+------+--------+---------+--------+
| id   | name   | dept    | salary |
+------+--------+---------+--------+
|    1 | Rahul  | IT      |  50000 |
|    2 | Ramesh | HR      |  35000 |
|   10 | Rohan  | IT      |  52000 |
|   14 | Rajesh | Finance |  51000 |
+------+--------+---------+--------+
4 rows in set (0.00 sec)

mysql> select * from emp where name like '%sh';
+------+--------+-----------+--------+
| id   | name   | dept      | salary |
+------+--------+-----------+--------+
|    2 | Ramesh | HR        |  35000 |
|    4 | Mahesh | Marketing |  40000 |
|    5 | Suresh | IT        |  55000 |
|    7 | Manish | Admin     |  42000 |
|    8 | Ganesh | Finance   |  47000 |
|    9 | Naresh | HR        |  39000 |
|   13 | Dinesh | Admin     |  46000 |
|   14 | Rajesh | Finance   |  51000 |
+------+--------+-----------+--------+
8 rows in set (0.00 sec)

mysql> select * from emp where name like '%ar%';
+------+--------+---------+--------+
| id   | name   | dept    | salary |
+------+--------+---------+--------+
|    3 | Karan  | Finance |  45000 |
|    6 | Arjun  | Sales   |  38000 |
|    9 | Naresh | HR      |  39000 |
+------+--------+---------+--------+
3 rows in set (0.00 sec)

mysql> select * from emp where name like '_____';
+------+-------+---------+--------+
| id   | name  | dept    | salary |
+------+-------+---------+--------+
|    1 | Rahul | IT      |  50000 |
|    3 | Karan | Finance |  45000 |
|    6 | Arjun | Sales   |  38000 |
|   10 | Rohan | IT      |  52000 |
|   11 | Mohan | Sales   |  41000 |
|   15 | Kiran | IT      |  48000 |
+------+-------+---------+--------+
6 rows in set (0.00 sec)

mysql> select * from emp where name like 'k%n';
+------+--------+-----------+--------+
| id   | name   | dept      | salary |
+------+--------+-----------+--------+
|    3 | Karan  | Finance   |  45000 |
|   12 | Kishan | Marketing |  43000 |
|   15 | Kiran  | IT        |  48000 |
+------+--------+-----------+--------+
3 rows in set (0.00 sec)

mysql> select * from emp where name like 'm%e%';
+------+--------+-----------+--------+
| id   | name   | dept      | salary |
+------+--------+-----------+--------+
|    4 | Mahesh | Marketing |  40000 |
+------+--------+-----------+--------+
1 row in set (0.00 sec)

mysql> select * from emp where name like '_____h';
+------+--------+-----------+--------+
| id   | name   | dept      | salary |
+------+--------+-----------+--------+
|    2 | Ramesh | HR        |  35000 |
|    4 | Mahesh | Marketing |  40000 |
|    5 | Suresh | IT        |  55000 |
|    7 | Manish | Admin     |  42000 |
|    8 | Ganesh | Finance   |  47000 |
|    9 | Naresh | HR        |  39000 |
|   13 | Dinesh | Admin     |  46000 |
|   14 | Rajesh | Finance   |  51000 |
+------+--------+-----------+--------+
8 rows in set (0.00 sec)

mysql> select * from emp where name like 'a%' or 'e%' or 'i%' or 'o%' or 'u%';
+------+-------+-------+--------+
| id   | name  | dept  | salary |
+------+-------+-------+--------+
|    6 | Arjun | Sales |  38000 |
+------+-------+-------+--------+
1 row in set, 4 warnings (0.00 sec)

mysql> select * from emp where name not like 'a%' or 'e%' or 'i%' or 'o%' or 'u%';
+------+--------+-----------+--------+
| id   | name   | dept      | salary |
+------+--------+-----------+--------+
|    1 | Rahul  | IT        |  50000 |
|    2 | Ramesh | HR        |  35000 |
|    3 | Karan  | Finance   |  45000 |
|    4 | Mahesh | Marketing |  40000 |
|    5 | Suresh | IT        |  55000 |
|    7 | Manish | Admin     |  42000 |
|    8 | Ganesh | Finance   |  47000 |
|    9 | Naresh | HR        |  39000 |
|   10 | Rohan  | IT        |  52000 |
|   11 | Mohan  | Sales     |  41000 |
|   12 | Kishan | Marketing |  43000 |
|   13 | Dinesh | Admin     |  46000 |
|   14 | Rajesh | Finance   |  51000 |
|   15 | Kiran  | IT        |  48000 |
+------+--------+-----------+--------+
14 rows in set, 4 warnings (0.00 sec)

mysql> show tabbles;
ERROR 1064 (42000): You have an error in your SQL syntax; check the manual that corresponds to your MySQL server version for the right syntax to use near 'tabbles' at line 1
mysql> show tables;
+------------------+
| Tables_in_da4    |
+------------------+
| backup_employees |
| company_staff    |
| emp              |
| employee         |
| employees        |
| orders           |
| products         |
| projects         |
| students         |
| studentscores    |
+------------------+
10 rows in set (0.01 sec)

mysql> drop employees;
ERROR 1064 (42000): You have an error in your SQL syntax; check the manual that corresponds to your MySQL server version for the right syntax to use near 'employees' at line 1
mysql> drop table employees;
Query OK, 0 rows affected (0.02 sec)

mysql> CREATE TABLE employees (
    ->     emp_id INT PRIMARY KEY,
    ->     emp_name VARCHAR(50),
    ->     department VARCHAR(30),
    ->     salary DECIMAL(10,2),
    ->     experience INT,
    ->     age INT
    -> );
Query OK, 0 rows affected (0.03 sec)

mysql> 
mysql> INSERT INTO employees VALUES
    -> (101,'Ravi','IT',65000,5,28),
    -> (102,'Priya','HR',45000,2,24),
    -> (103,'Amit','Finance',75000,8,35),
    -> (104,'Sneha','IT',55000,3,27),
    -> (105,'Rahul','Sales',40000,1,22),
    -> (106,'Kiran','Finance',90000,12,40),
    -> (107,'Anjali','HR',52000,4,29),
    -> (108,'Suresh','Sales',68000,7,33);
Query OK, 8 rows affected (0.01 sec)
Records: 8  Duplicates: 0  Warnings: 0

mysql> select * from employees;
+--------+----------+------------+----------+------------+------+
| emp_id | emp_name | department | salary   | experience | age  |
+--------+----------+------------+----------+------------+------+
|    101 | Ravi     | IT         | 65000.00 |          5 |   28 |
|    102 | Priya    | HR         | 45000.00 |          2 |   24 |
|    103 | Amit     | Finance    | 75000.00 |          8 |   35 |
|    104 | Sneha    | IT         | 55000.00 |          3 |   27 |
|    105 | Rahul    | Sales      | 40000.00 |          1 |   22 |
|    106 | Kiran    | Finance    | 90000.00 |         12 |   40 |
|    107 | Anjali   | HR         | 52000.00 |          4 |   29 |
|    108 | Suresh   | Sales      | 68000.00 |          7 |   33 |
+--------+----------+------------+----------+------------+------+
8 rows in set (0.00 sec)

mysql> select emp_name,salary
    -> ^C
mysql> select emp_name,salary,
    -> case
    -> when salary >= 80000 then 'high_salary'
    -> when salary >= 60000 then 'medium_salary'
    -> else 'low_salary'
    -> end as salary_category
    -> from employees;
+----------+----------+-----------------+
| emp_name | salary   | salary_category |
+----------+----------+-----------------+
| Ravi     | 65000.00 | medium_salary   |
| Priya    | 45000.00 | low_salary      |
| Amit     | 75000.00 | medium_salary   |
| Sneha    | 55000.00 | low_salary      |
| Rahul    | 40000.00 | low_salary      |
| Kiran    | 90000.00 | high_salary     |
| Anjali   | 52000.00 | low_salary      |
| Suresh   | 68000.00 | medium_salary   |
+----------+----------+-----------------+
8 rows in set (0.00 sec)

mysql> select emp_id,emp_name,experience,
    -> case
    -> where
    -> ^C
mysql> select emp_id,emp_name,experience,
    -> case
    -> when experience>= 10 'EXPERT'
    -> when experience>= 5 'SENIOR'
    -> else 'FRESHER'
    -> end as category
    -> from employees;
ERROR 1064 (42000): You have an error in your SQL syntax; check the manual that corresponds to your MySQL server version for the right syntax to use near ''EXPERT'
when experience>= 5 'SENIOR'
else 'FRESHER'
end as category
from employ' at line 3
mysql> select emp_id,emp_name,experience,
    -> case
    -> when experience>= 10 then 'EXPERT'
    -> when experience>= 5 then 'SENIOR'
    -> else 'FRESHER'
    -> end as category
    -> from employees;
+--------+----------+------------+----------+
| emp_id | emp_name | experience | category |
+--------+----------+------------+----------+
|    101 | Ravi     |          5 | SENIOR   |
|    102 | Priya    |          2 | FRESHER  |
|    103 | Amit     |          8 | SENIOR   |
|    104 | Sneha    |          3 | FRESHER  |
|    105 | Rahul    |          1 | FRESHER  |
|    106 | Kiran    |         12 | EXPERT   |
|    107 | Anjali   |          4 | FRESHER  |
|    108 | Suresh   |          7 | SENIOR   |
+--------+----------+------------+----------+
8 rows in set (0.00 sec)

mysql> select emp_id,emp_name,age,
    -> case
    -> when age>=18 then 'ELIGIBLE_TO_VOTE'
    -> else 'NOT_ELIGBLE_TO_VOTE'
    -> end as vote_eligibility
    -> from employees;
+--------+----------+------+------------------+
| emp_id | emp_name | age  | vote_eligibility |
+--------+----------+------+------------------+
|    101 | Ravi     |   28 | ELIGIBLE_TO_VOTE |
|    102 | Priya    |   24 | ELIGIBLE_TO_VOTE |
|    103 | Amit     |   35 | ELIGIBLE_TO_VOTE |
|    104 | Sneha    |   27 | ELIGIBLE_TO_VOTE |
|    105 | Rahul    |   22 | ELIGIBLE_TO_VOTE |
|    106 | Kiran    |   40 | ELIGIBLE_TO_VOTE |
|    107 | Anjali   |   29 | ELIGIBLE_TO_VOTE |
|    108 | Suresh   |   33 | ELIGIBLE_TO_VOTE |
+--------+----------+------+------------------+
8 rows in set (0.00 sec)

smysql> Terminal close -- exit!
